<?xml version="1.0" encoding="UTF-8"?>
<Prijava xmlns="http://www.ftn.uns.ac.rs/zig"
    xmlns:xsi="http://www.w3.org/2001/XMLSchema-instance"
    xsi:schemaLocation="http://www.ftn.uns.ac.rs/zig ../../../../../resources/xml_files/Zig.xsd">
    <Podnosilac_prijave xsi:type="TFizickoLice">
        <adresa>
            <ulica></ulica>
            <broj></broj>
            <postanski_broj>35000</postanski_broj>
            <mesto></mesto>
            <drzava></drzava>
        </adresa>
        <kontakt>
            <broj_telefona></broj_telefona>
            <broj_faksa></broj_faksa>
            <e_posta></e_posta>
        </kontakt>
        <ime>Stefan</ime>
        <prezime>Milos</prezime>
    </Podnosilac_prijave>
    <Punomocnik xsi:type="TFizickoLice">
        <adresa>
            <ulica></ulica>
            <broj></broj>
            <postanski_broj>35000</postanski_broj>
            <mesto></mesto>
            <drzava></drzava>
        </adresa>
        <kontakt>
            <broj_telefona></broj_telefona>
            <broj_faksa></broj_faksa>
            <e_posta></e_posta>
        </kontakt>
        <ime>Stefan</ime>
        <prezime>Milosevic</prezime>
    </Punomocnik>
    <Zajednicki_predstavnik xsi:type="TFizickoLice">
        <adresa>
            <ulica></ulica>
            <broj></broj>
            <postanski_broj>35000</postanski_broj>
            <mesto></mesto>
            <drzava></drzava>
        </adresa>
        <kontakt>
            <broj_telefona></broj_telefona>
            <broj_faksa></broj_faksa>
            <e_posta></e_posta>
        </kontakt>
        <ime>Prsa</ime>
        <prezime>asgags</prezime>
    </Zajednicki_predstavnik>
    <Informacije_o_zigu>
        <Tip_ziga>INDIVIDUALNI_ZIG</Tip_ziga>
        <Tip_znaka>TRODIMENZIONALNI_ZNAK</Tip_znaka>
        <Izgled_znaka></Izgled_znaka>
        <Boje_znaka>
            <Boja></Boja>
        </Boje_znaka>
        <Opis_znaka></Opis_znaka>
        <Nicanska_klasifikacija>
            <Klasa>2</Klasa>
        </Nicanska_klasifikacija>
    </Informacije_o_zigu>
    <Takse>
        <Osnovna_taksa>222</Osnovna_taksa>
        <Ukupna_taksa>2222</Ukupna_taksa>
    </Takse>
    <Informacija_zavoda>
        <Broj_prijave></Broj_prijave>
        <Datum_podnosenja>2020-02-02</Datum_podnosenja>
        <Prilozi>
            <Primerak_znaka></Primerak_znaka>
            <Spisak_robe_i_usluga></Spisak_robe_i_usluga>
            <Punomocje></Punomocje>
            <Naknadno_dostavljeno_punomocje>false</Naknadno_dostavljeno_punomocje>
            <Generalno_punomocje></Generalno_punomocje>
            <Opsti_akt></Opsti_akt>
            <Dokaz_o_pravu_prvenstva></Dokaz_o_pravu_prvenstva>
            <Dokaz_o_uplati_takse></Dokaz_o_uplati_takse>
        </Prilozi>
    </Informacija_zavoda>
</Prijava>